<?xml version='1.0' encoding='UTF-8' ?>

<!DOCTYPE helpserver_display PUBLIC "-//4ST//DTD HelpServer display 01//EN" "helpserver_display.dtd">

<helpserver_display>
  <head>
     <unittypes>
      <unittype id="G">General</unittype>
    </unittypes>

  </head>
  <folder key="BOOK    13795967172060">
    <title>LST6100 Broadcast Satellite Modem</title>
    <lines>
      <topic key="BT1368015565427" pointername="copyright">
        <title>Copyright</title>
        <units>
          <unit type="G">
            <data>
              <par style="Body Text">
                © March 11, 2022
              </par>
              <par style="Body Text">
                The material contained in this document is confidential and intended for use only by parties authorized by LogoSat Cy N.V.
              </par>
              <par style="Body Text">
                All Rights Reserved. No part of this document may be photocopied, reproduced, stored in a retrieval system, or transmitted, in any form or by any means whether, electronic, mechanical, or otherwise without the prior written permission of:
              </par>

              <par style="Body Text">
                LogoSat Cy N.V.
              </par>
              <par style="Body Text">
                Superstraat 5
              </par>
              <par style="Body Text">
                9100 Sint-Kristoff, Belgium
              </par>
              <par style="Body Text">
                tel: +32 (0)3 999 65 00
              </par>
              <par style="Body Text">
                fax: +32 (0)3 999 65 49<br/><url id="http://www.LogoSat.eu" actiontype="newwindow" activation="linktext">
                  <style stylename="Url">www.LogoSat.eu</style>
                </url> <br/><url id="mailto:sales@LogoSat.eu" actiontype="newwindow" activation="linktext">
                  <style stylename="Url">sales@LogoSat.eu</style>
                </url>
              </par>

            </data>
          </unit>
        </units>
      </topic>
      <folder key="CHAPTER 13649981147582">
        <title>EU Compliancy Statements</title>
        <lines>
          <topic key="BT1369312951175" autostart="true" hidedes="true">
            <title>To Whom It May Concern</title>
            <units>
              <unit type="G">
                <data>
                  <par style="Body Text">
                    <table rules="none">
                      <colgroup>
                        <col width="71"/>
                        <col width="535"/>
                      </colgroup>
                      <tr>
                        <td align="left" valign="middle" background-color="#FFFFFF" padding-top="5" padding-bottom="5" padding-left="5" padding-right="5">
                          <data>
                            <par style="table bodytext center">
                              <image id="imageFiles/524971/image004.png" width="36" height="36"/>
                            </par>
                          </data>
                        </td>
                        <td align="left" valign="middle" background-color="#C8C8C8" padding-top="7" padding-bottom="7" padding-left="7" padding-right="7">
                          <data>
                            <par style="Table bodytext">
                              To Whom it May Concern.
                            </par>
                          </data>
                        </td>
                      </tr>
                    </table>

                  </par>
                </data>
              </unit>
            </units>
          </topic>
          <topic key="BT13649981147583">
            <title>Radio and Telecommunications Terminal Equipment (R&amp;TTE) 5 Directive 1995/5/EC</title>
            <units>
              <unit type="G">
                <data>
                  <par style="Body Text">
                    We,
                  </par>
                  <par style="Body Text">
                    Declare that the following product:
                  </par>
                  <par style="ListBul 1">
                    Product number: LST6100
                  </par>
                  <par style="ListBul 1">
                    Type identifier: NTC/2353
                  </par>
                  <par style="Body Text">
                    to which this declaration relates is in conformity with the essential requirements of European Union Directive 1999/5/EC Radio and Telecommunication Terminal Equipment Directive Essential Requirement 3.1(a), 3.1 (b), 3.2.
                  </par>
                  <par style="Body Text">
                    Done at St-Kristoff, on March 11, 2016
                  </par>
                  <par style="Body Text">
                    <image id="imageFiles/524048/image001.png" width="130" height="91" scale="82"/>
                  </par>
                  <par style="Body Text">
                    Serge Van Herck,
                  </par>
                  <par style="Body Text">
                    CEO
                  </par>
                  <par style="Body Text">
                    LogoSat Cy N.V.
                  </par>
                  <par style="Body Text">
                    Superstraat 5 B-9100 Sint-Kristoff Belgium.
                  </par>
                  <par style="Body Text">
                    Tel: +32 (0)3 999 65 00
                  </par>
                  <par style="Body Text">
                    Fax: +32 (0)3 999 65 49
                  </par>
                </data>
              </unit>
            </units>
          </topic>
          <topic key="M61378726399990">
            <title>EMC Information</title>
            <units>
              <unit type="G">
                <data>
                  <par style="Body Text">
                    Relevant EMC information (to FCC rules)
                  </par>
                  <par style="Body Text">
                    This equipment has been tested and was found to comply with the limits for a class A digital device, pursuant to part 15 of the FCC Rules. These limits are designed to provide reasonable protection against harmful interference when the equipment is operated in a commercial environment. This equipment generates, uses and radiates radio frequency energy. If not installed and used in accordance with the instruction manual, it may cause harmful interference to radio communications.
                  </par>
                  <par style="Body Text">
                    Do not operate this equipment in a residential area, as it is likely to cause harmful interference. When this is the case, you will be required to correct the interference at your own expense.
                  </par>
                </data>
              </unit>
            </units>
          </topic>
          <topic key="BT13649981147585">
            <title>Restriction of Hazardous Substances Directive (RoHS) (Directive  2011/65/EU)</title>
            <units>
              <unit type="G">
                <data>
                  <par style="Body Text">
                    The undersigned hereby confirms the following statement:
                  </par>
                  <par style="Body Text">
                    We hereby declare that this equipment is compliant to the RoHS Directive 2011/65/EU.
                  </par>
                  <par style="Body Text">
                    Done at St-Kristoff, on March 11, 2016
                  </par>
                  <par style="Body Text">
                    <image id="imageFiles/524048/image001.png" width="130" height="91" scale="82"/>
                  </par>
                  <par style="Body Text">
                    Serge Van Herck,
                  </par>
                  <par style="Body Text">
                    CEO
                  </par>
                  <par style="Body Text">
                    LogoSat Cy N.V.
                  </par>
                  <par style="Body Text">
                    Superstraat 5 B-9100 Sint-Kristoff Belgium.
                  </par>
                  <par style="Body Text">
                    Tel: +32 (0)3 999 65 00
                  </par>
                  <par style="Body Text">
                    Fax: +32 (0)3 999 65 49
                  </par>
                </data>
              </unit>
            </units>
          </topic>
          <topic key="BT13649981147586">
            <title>Registration, Evaluation and Authorization of Chemicals (REACH)</title>
            <units>
              <unit type="G">
                <data>
                  <par style="Body Text">
                    European Regulation N°1907/2006 &quot;REACH&quot; (Registration, Evaluation, and Authorization of Chemicals), came into force on June 1st, 2007. It aims at regulating the use of the chemical substances within the European Union.
                  </par>
                  <par style="Body Text">
                    We are committed to meeting our legal obligations under REACH, as a manufacturer of articles and as a downstream user of chemicals products.
                  </par>
                  <par style="Body Text">
                    In order to comply with the REACH regulation, LogoSat Cy N.V. has put into place processes and procedures to ensure implementation and compliance with the regulation, especially the assessment of the presence of Substances of Very High Concern (SVHC&apos;s) and communication along the supply chain to both suppliers and customers.
                  </par>
                  <par style="Body Text">